{
  "schema_version": 1,
  "status": "example",
  "method": "proposed",
  "seed": 42,
  "sampling_steps": 4,
  "nfe": 4,
  "dataset": "CIFAR-10",
  "image_size": 32,
  "num_samples": 10000,
  "num_real": 10000,
  "reference_split": "test",
  "eval_seed": 12345,
  "sampler": "DDIM-eta0-unclipped-nested-v1",
  "precision": "bf16",
  "metric_implementation": "torch-fidelity-0.3.0",
  "training_updates": 20000,
  "effective_batch_size": 32,
  "teacher_identity": "google/ddpm-cifar10-32@267b167dc01f0e4e61923ea244e8b988f84deb80",
  "initial_steps": 64,
  "training_seconds": 0,
  "fid": null,
  "inception_score_mean": null,
  "inception_score_std": null,
  "latency_ms_per_image": 1,
  "benchmark_batch_size": 1,
  "environment": {"hardware": "REPLACE WITH ACTUAL GPU"},
  "timesteps": [999, 745, 492, 238],
  "model_identity": "REPLACE WITH ACTUAL CHECKPOINT SHA256"
}
